{
  "schema": 1,
  "id": "0c1d4e6f-2a3b-4c5d-8e9f-0a1b2c3d4e5f",
  "robot_id": "arm_left",
  "type": "cancel",
  "task": null,
  "accepted": true,
  "code": "accepted",
  "reason": "",
  "received_at": 1760356802011,
  "clock_skew_ms": 11,
  "session": "9f1c7a0e-4a1b-4b2c-8d1e-0f1a2b3c4d5e",
  "ts": 1760356802012
}
