{
  "schema": 1,
  "id": "6a0c2b58-1d7e-4a1f-9b2a-3c4d5e6f7a8b",
  "robot_id": "arm_left",
  "type": "task",
  "task": "move_to",
  "accepted": true,
  "code": "accepted",
  "reason": "",
  "received_at": 1760356800962,
  "clock_skew_ms": 12,
  "session": "9f1c7a0e-4a1b-4b2c-8d1e-0f1a2b3c4d5e",
  "ts": 1760356800963
}
